Counties,stations,station_latitude,station_longitude
San Diego,"CARLSBAD MCCLELLAN PALOMAR AIRPORT, CA US",33.12806,-117.27944
San Diego,"SAN DIEGO INTERNATIONAL AIRPORT, CA US",32.7336,-117.1831
San Diego,"SAN DIEGO BROWN FIELD, CA US",32.57222,-116.97944
San Diego,"NORTH ISLAND NAS, CA US",32.7,-117.2
San Diego,"SAN DIEGO MONTGOMERY FIELD, CA US",32.81583,-117.13944
San Diego,"RAMONA AIRPORT, CA US",33.0375,-116.91583
Riverside,"BLYTHE ASOS, CA US",33.6186,-114.7142
Riverside,"PALM SPRINGS ASOS, CA US",33.8222,-116.5043
Riverside,"RIVERSIDE MUNICIPAL AIRPORT, CA US",33.95194,-117.43861
